WFOID,IPNID,scientificName,authorship,namePublishedin,Family,nomenclaturalStatus,originalName,originalNameAuthor
wfo-1200116507,urn:lsid:ipni.org:names:77361738-1,Lithops gracilidelineata subsp. mopane,S.Hatt,Kew Bull. 80(4): 7 of 10. 2025 [2 Dec 2025] [epublished],Aizoaceae,,,
wfo-1000081368,urn:lsid:ipni.org:names:77372792-1,Pilosocereus novaromanus,Oliveira-Pereira & Olsthoorn,Bradleya 43: 83. 2025 [24 Apr 2025] ,Cactaceae,,,
wfo-1200114755,urn:lsid:ipni.org:names:77372793-1,Melocactus levitestatus subsp. goianus,Oliveira-Pereira & Olsthoorn,Bradleya 43: 110. 2025 [24 Apr 2025] ,Cactaceae,,,
wfo-1200114756,urn:lsid:ipni.org:names:77372794-1,Melocactus zehntneri subsp. adpressispinus,N.P.Taylor,Bradleya 43: 114. 2025 [24 Apr 2025] ,Cactaceae,,,
wfo-1000086635,urn:lsid:ipni.org:names:77372797-1,Antimima calcarea,Klak,Bradleya 43: 187. 2025 [24 Apr 2025] ,Aizoaceae,,,
wfo-1000086636,urn:lsid:ipni.org:names:77372798-1,Arenifera kamiesbergensis,Klak,Bradleya 43: 188. 2025 [24 Apr 2025] ,Aizoaceae,,,
wfo-1000086637,urn:lsid:ipni.org:names:77372799-1,Lampranthus saxatilis,Klak,Bradleya 43: 191. 2025 [24 Apr 2025] ,Aizoaceae,,,
wfo-1000086649,urn:lsid:ipni.org:names:77372812-1,Lampranthus worcesterensis,Klak & A.le Roux,Bradleya 43: 193. 2025 [24 Apr 2025] ,Aizoaceae,,,
wfo-1000086650,urn:lsid:ipni.org:names:77372813-1,Leipoldtia quarciticola,Klak,Bradleya 43: 195. 2025 [24 Apr 2025] ,Aizoaceae,,,
wfo-1000086651,urn:lsid:ipni.org:names:77372814-1,Phiambolia ericoides,Klak,Bradleya 43: 198. 2025 [24 Apr 2025] ,Aizoaceae,,,
wfo-1000086652,urn:lsid:ipni.org:names:77372815-1,Phiambolia pauciflora,Klak,Bradleya 43: 200. 2025 [24 Apr 2025] ,Aizoaceae,,,
wfo-1000086653,urn:lsid:ipni.org:names:77372816-1,Ruschia namaqualina,Klak,Bradleya 43: 203. 2025 [24 Apr 2025] ,Aizoaceae,,,
wfo-1000086654,urn:lsid:ipni.org:names:77372817-1,Ruschiella mollissima,Klak,Bradleya 43: 207. 2025 [24 Apr 2025] ,Aizoaceae,,,
wfo-1000086655,urn:lsid:ipni.org:names:77372818-1,Ruschiella frederici,(L.Bolus) Klak,Bradleya 43: 208. 2025 [24 Apr 2025] ,Aizoaceae,,Aizoaceae Mesembryanthemum frederici L.Bolus,(L.Bolus)
wfo-1000086656,urn:lsid:ipni.org:names:77372819-1,Smicrostigma intermedium,Klak,Bradleya 43: 210. 2025 [24 Apr 2025] ,Aizoaceae,,,
wfo-1000086671,urn:lsid:ipni.org:names:77372950-1,Chorizanthe limariensis,Teillier & J.Macaya,"Gayana, Bot. 76(1): 44. 2019 [30 Jun 2019] [epublished]",Polygonaceae,,,
wfo-1000086683,urn:lsid:ipni.org:names:77372970-1,Cerastium yulaoianum,S.S.Ying,New Taxa New Names 8: 128. 2025 [30 Nov 2025] [epublished],Caryophyllaceae,,,
wfo-1000086713,urn:lsid:ipni.org:names:77373007-1,Opuntia subcylindrica,(M.Machado & N.P.Taylor) Batov,Opred. Vidov Kaktusov Kult. 2(1): 126. 2023 ,Cactaceae,,Cactaceae Tacinga inamoena (K.Schum.) N.P.Taylor & Stuppy subsp. subcylindrica M.Machado & N.P.Taylor,(M.Machado & N.P.Taylor)
wfo-1000086715,urn:lsid:ipni.org:names:77373009-1,Cumulopuntia minor,(Backeb.) Batov,Opred. Vidov Kaktusov Kult. 2(1): 196. 2023 ,Cactaceae,,Cactaceae Tephrocactus minor Backeb.,(Backeb.)
wfo-1000086716,urn:lsid:ipni.org:names:77373010-1,Cumulopuntia ferocior,(Backeb.) Batov,Opred. Vidov Kaktusov Kult. 2(1): 252. 2023 ,Cactaceae,,Cactaceae Tephrocactus ferocior Backeb.,(Backeb.)
wfo-1200116320,urn:lsid:ipni.org:names:77373011-1,Cumulopuntia fulvicoma var. bicolor,(Rauh & Backeb.) Batov,Opred. Vidov Kaktusov Kult. 2(1): 294. 2023 ,Cactaceae,,Cactaceae Tephrocactus fulvicomus  var. bicolor Rauh & Backeb.,(Rauh & Backeb.)
wfo-1200116324,urn:lsid:ipni.org:names:77373171-1,Cumulopuntia pentlandii var. fuauxiana,(Backeb.) Batov,Opred. Vidov Kaktusov Kult. 2(1): 298. 2023 ,Cactaceae,,Cactaceae Tephrocactus pentlandii (Salm-Dyck) Backeb. var. fuauxianus Backeb.,(Backeb.)
wfo-1000086759,urn:lsid:ipni.org:names:77373172-1,Austrocylindropuntia heteromorpha,(Phil.) Batov,Opred. Vidov Kaktusov Kult. 2(1): 311. 2023 ,Cactaceae,,Cactaceae Opuntia heteromorpha Phil.,(Phil.)
wfo-1000086760,urn:lsid:ipni.org:names:77373173-1,Maihueniopsis chilensis,(Backeb.) Batov,Opred. Vidov Kaktusov Kult. 2(1): 319. 2023 ,Cactaceae,,Cactaceae Tephrocactus chilensis Backeb.,(Backeb.)
wfo-1000086761,urn:lsid:ipni.org:names:77373174-1,Tunilla longispina,(Haw.) Batov,Opred. Vidov Kaktusov Kult. 2(1): 320. 2023 ,Cactaceae,,Cactaceae Opuntia longispina Haw.,(Haw.)
wfo-1000086762,urn:lsid:ipni.org:names:77373175-1,Austrocylindropuntia blancii,(Backeb.) Batov,Opred. Vidov Kaktusov Kult. 2(1): 346. 2023 ,Cactaceae,,Cactaceae Tephrocactus blancii Backeb.,(Backeb.)
wfo-1200116325,urn:lsid:ipni.org:names:77373176-1,Cumulopuntia kuehnrichiana var. applanata,(Werderm. & Backeb.) Batov,Opred. Vidov Kaktusov Kult. 2(1): 361. 2023 ,Cactaceae,,Cactaceae Opuntia kuehnrichiana  var. applanata Werderm. & Backeb.,(Werderm. & Backeb.)
wfo-1000086763,urn:lsid:ipni.org:names:77373177-1,Cumulopuntia mira,(Rauh & Backeb.) Batov,Opred. Vidov Kaktusov Kult. 2(1): 367. 2023 ,Cactaceae,,Cactaceae Tephrocactus mirus Rauh & Backeb.,(Rauh & Backeb.)
wfo-1200116326,urn:lsid:ipni.org:names:77373178-1,Cumulopuntia corotilla var. auranticiflora,(Rauh & Backeb.) Batov,Opred. Vidov Kaktusov Kult. 2(1): 368. 2023 ,Cactaceae,,Cactaceae Tephrocactus corotilla (K.Schum.) Backeb. var. aurantiaciflorus Rauh & Backeb.,(Rauh & Backeb.)
wfo-1000086764,urn:lsid:ipni.org:names:77373179-1,Tunilla armata,(Backeb.) Batov,Opred. Vidov Kaktusov Kult. 2(1): 378. 2023 ,Cactaceae,,Cactaceae Opuntia armata Backeb.,(Backeb.)
wfo-1200116327,urn:lsid:ipni.org:names:77373180-1,Tunilla armata var. panellana,(Backeb.) Batov,Opred. Vidov Kaktusov Kult. 2(1): 378. 2023 ,Cactaceae,,Cactaceae Opuntia armata Backeb. var. panellana Backeb.,(Backeb.)
wfo-1000086767,urn:lsid:ipni.org:names:77373183-1,Tunilla retrospinosa,(Lem.) Batov,Opred. Vidov Kaktusov Kult. 2(1): 320. 2023 ,Cactaceae,,Cactaceae Opuntia retrospinosa Lem.,(Lem.)
wfo-1000086769,urn:lsid:ipni.org:names:77373185-1,Tunilla boliviensis,(Backeb.) Batov,Opred. Vidov Kaktusov Kult. 2(1): 377. 2023 ,Cactaceae,,Cactaceae Opuntia boliviensis Backeb.,(Backeb.)
wfo-1000086772,urn:lsid:ipni.org:names:77373188-1,Tephrocactus × fiambalensis,Popov & V.Gapon,Kaktus-Klub 15(3-4): 43. 2017 [Jul 2017] ,Cactaceae,,,
wfo-1200116328,urn:lsid:ipni.org:names:77373197-1,Tephrocactus ovatus subsp. halophilus,(Speg.) Popov & V.Gapon,Kaktus-Klub 15(3-4): 39. 2017 [Jul 2017] ,Cactaceae,,Cactaceae Opuntia halophila Speg.,(Speg.)
wfo-1200116329,urn:lsid:ipni.org:names:77373198-1,Saponaria ocymoides subsp. calabrica,(Guss.) Arcang.,"Comp. Fl. Ital., ed. 2 [Arcangeli] 304. 1894 [Jul - Sep 1894] ",Caryophyllaceae,,Caryophyllaceae Saponaria calabrica Guss.,(Guss.)
wfo-0000713669,urn:lsid:ipni.org:names:77373200-1,Gypsophila perfoliata var. tomentosa,Ser.,Prodr. [A. P. de Candolle] 1: 352. 1824 [mid-Jan 1824] ,Caryophyllaceae,,,
wfo-1200116404,urn:lsid:ipni.org:names:77373213-1,Koenigia microcarpa,"(Kitag.) H.F.Wang, X.Y.Dong & K.P.Ma",Checkl. Vasc. Pl. E. Asia 2: 1402. 2025 [Aug 2025] ,Polygonaceae,"nom. inval.    , basionym not cited",Polygonaceae Pleuropteropyrum microcarpum Kitag.,(Kitag.)
wfo-1200116405,urn:lsid:ipni.org:names:77373215-1,Koenigia mollifolia,"(Kitag.) H.F.Wang, X.Y.Dong & K.P.Ma",Checkl. Vasc. Pl. E. Asia 2: 1402. 2025 [Aug 2025] ,Polygonaceae,"nom. inval.    , basionym not cited",Polygonaceae Pleuropteropyrum mollifolium Kitag.,(Kitag.)
wfo-1000086783,urn:lsid:ipni.org:names:77373216-1,Koenigia sinomontana,"(Sam.) H.F.Wang, X.Y.Dong & K.P.Ma",Checkl. Vasc. Pl. E. Asia 2: 1402. 2025 [Aug 2025] ,Polygonaceae,"nom. inval.    , basionym not cited",Polygonaceae Polygonum sinomontanum Sam.,(Sam.)
wfo-1000086784,urn:lsid:ipni.org:names:77373220-1,Cherleria hondoensis,"(Ohwi) H.F.Wang, X.Y.Dong & K.P.Ma",Checkl. Vasc. Pl. E. Asia 2: 1418. 2025 [Aug 2025] ,Caryophyllaceae,"nom. inval.    , basionym not cited",Caryophyllaceae Minuartia arctica (Steven) Graebn. var. hondoensis Ohwi,(Ohwi)
wfo-1200116408,urn:lsid:ipni.org:names:77373233-1,Koenigia ajanensis,"(Regel & Tiling) H.F.Wang, X.Y.Dong & K.P.Ma",Checkl. Vasc. Pl. E. Asia 2: 2305. 2025 [Aug 2025] ,Polygonaceae,"nom. inval.    , basionym not cited",Polygonaceae Polygonum polymorphum Ledeb. var. ajanense Regel & Tiling,(Regel & Tiling)
wfo-1200116409,urn:lsid:ipni.org:names:77373234-1,Koenigia sericea,"(Georgi) H.F.Wang, X.Y.Dong & K.P.Ma",Checkl. Vasc. Pl. E. Asia 2: 2305. 2025 [Aug 2025] ,Polygonaceae,"nom. inval.    , lacking basionym ref",Polygonaceae Polygonum sericeum Georgi,(Georgi)
wfo-0000438250,urn:lsid:ipni.org:names:77373243-1,Saponaria calabrica,Guss.,Index Seminum [Boccadifalco] 1825: 10. ,Caryophyllaceae,,,
wfo-1200116415,urn:lsid:ipni.org:names:77373257-1,Myricaria longifolia,(Willd.) DC.,Prodr. [A. P. de Candolle] 3: 97. 1828 [mid Mar 1828] ,Tamaricaceae,isonym,Tamaricaceae Tamarix longifolia Willd.,(Willd.)
wfo-1200116419,urn:lsid:ipni.org:names:77373392-1,Rumex chilensis,Desf.,"Tabl. École Bot., ed. 3 (Cat. Pl. Horti Paris.) 429. 1832 ",Polygonaceae,nom. illeg. nom. superfl.,,
wfo-1000086853,urn:lsid:ipni.org:names:77373418-1,Corryocactus volcanicus,A.Pauca & Hoxey,Phytotaxa 733(3): 283. 2025 [12 Dec 2025] [epublished],Cactaceae,,,
wfo-1000086862,urn:lsid:ipni.org:names:77373502-1,Astrophytum sect. Austrastrophytum,Megata,Mem. Coll. Agric. Kyoto Imp. Univ. Hort. Ser. 2(no. 56): 36. 1944 [Jul 1944] ,Cactaceae,,,
wfo-1200116434,urn:lsid:ipni.org:names:77373503-1,Astrophytum ornatum var. mirbelii,(Lem.) Megata,Mem. Coll. Agric. Kyoto Imp. Univ. Hort. Ser. 2(no. 56): 38. 1944 [Jul 1944] (as 'var. Mirbelli'),Cactaceae,isonym,Cactaceae Echinocactus mirbelii Lem.,(Lem.)
wfo-1000086863,urn:lsid:ipni.org:names:77373504-1,Astrophytum sect. Septentriastrophytum,Megata,Mem. Coll. Agric. Kyoto Imp. Univ. Hort. Ser. 2(no. 56): 45. 1944 [Jul 1944] ,Cactaceae,,,
wfo-1000086864,urn:lsid:ipni.org:names:77373505-1,Neolloydia suguriana,Rodr.González & Linzen,Mitteilungsbl. Arbeitskreises Mammillarienfr. 49(2): 73. 2025 [2 Feb 2025] ,Cactaceae,,,
wfo-1200116349,urn:lsid:ipni.org:names:77373864-1,Rumex scutatus var. glaucescens,Guss.,Fl. Sicul. Prodr. 1: 446. 1827 [Oct-Dec 1827] ,Polygonaceae,,,
wfo-1200116453,urn:lsid:ipni.org:names:77373865-1,Rumex scutatus subsp. glaucescens,"(Guss.) Brullo, Scelsi & Spamp.",Itinera Geobot. 11: 404. 1998 [21 Dec 1998] ,Polygonaceae,,Polygonaceae Rumex scutatus L. var. glaucescens Guss.,(Guss.)
wfo-1000087083,urn:lsid:ipni.org:names:77373968-1,Silene niceensis,All.,Auct. Syn. Meth. Stirp. Hort. Regii Taur. 88. 1773 ,Caryophyllaceae,,,
wfo-1000087143,urn:lsid:ipni.org:names:77374058-1,Alsine palentiana,Gand.,Bull. Soc. Bot. France 45: 600. 1898 ,Caryophyllaceae,,,
wfo-1000087157,urn:lsid:ipni.org:names:77374078-1,Dianthus taigongensis,S.S.Ying,New Taxa New Names 8: 491. 2025 [30 Nov 2025] [epublished],Caryophyllaceae,,,
wfo-1200116483,urn:lsid:ipni.org:names:77374103-1,Opuntia flavispina,"(L.D.Benson) D.J.Ferguson, Joe J.Shaw & N.Hussey",Cact. Succ. J. (Los Angeles) 97(4): 353. 2025 [20 Nov 2025] ,Cactaceae,,Cactaceae Opuntia phaeacantha Engelm. var. flavispina L.D.Benson,(L.D.Benson)
wfo-1200116374,urn:lsid:ipni.org:names:77374225-1,Frailea schilinzkyana subsp. robusta,"V.Gapon, Ponomareva & Schädlich","Kaktus-Klub, n.s. 9(2): 28, Photogrs. 15-18, 22. 2025 [19 Dec 2025] (epublished)",Cactaceae,,,
wfo-1200116484,urn:lsid:ipni.org:names:77374226-1,Sulcorebutia callecallensis,(F.H.Brandt) V.Gapon,"Kaktus-Klub, n.s. 9(2): 65, Photogrs. 14-15. 2025 [19 Dec 2025] (epublished)",Cactaceae,,Cactaceae Weingartia callecallensis F.H.Brandt,(F.H.Brandt)
wfo-1200116384,urn:lsid:ipni.org:names:77374269-1,Saponaria calabrica var. graeca,Halácsy,Consp. Fl. Graec. 1(1): 189. 1900 ,Caryophyllaceae,,Caryophyllaceae Saponaria graeca Boiss.,
wfo-1200116385,urn:lsid:ipni.org:names:77374270-1,Saponaria officinalis var. pleniflora,Schur,Enum. Pl. Transsilv. 99. 1866 ,Caryophyllaceae,nom. inval. nom. nud.,,
wfo-1200116386,urn:lsid:ipni.org:names:77374271-1,Saponaria officinalis var. alluvionum,Prantl,Exkurs.-Fl. Bayern 188. 1884 ,Caryophyllaceae,,Caryophyllaceae Saponaria alluvionalis Du Moulin,
wfo-1000087324,urn:lsid:ipni.org:names:77374509-1,Silene aladagense,"Altınözlü, Aytaç & T.Ertuğrul",Phytotaxa 736(2): 168. 2025 [30 Dec 2025] [epublished],Caryophyllaceae,,,
