WFOID,IPNID,scientificName,authorship,namePublishedin,nomenclaturalStatus,originalName,originalNameAuthor
wfo-0000097388,urn:lsid:ipni.org:names:77373447-1,Hieracium nigritellum subsp. hololeptomorphum,Zahn,Hierac. Alp. Mar. 132. 1916 [Dec 1916] ,,,
wfo-0000018292,urn:lsid:ipni.org:names:77373448-1,Hieracium armerioides subsp. hololeptomorphum,(Zahn) Zahn,"Pflanzenr. (Engler) VI, 280(Heft 75): 138. 1921 [4 Feb 1921] ",,Asteraceae Hieracium nigritellum Arv.-Touv. subsp. hololeptomorphum Zahn,(Zahn)
wfo-1200116493,urn:lsid:ipni.org:names:77373449-1,Hieracium cirritum [infrasp.unranked] rhombophyllum,Nägeli & Peter,Hierac. Mitt.-Eur. 2: 262. 1889 ,,,
wfo-0000090483,urn:lsid:ipni.org:names:77373450-1,Hieracium armerioides subsp. rhombophyllum,(Nägeli & Peter) Zahn,"Fl. Schweiz (Schinz), ed. 2. 2: 298. 1905 ",,Asteraceae Hieracium cirritum Arv.-Touv. [infrasp.unranked] rhombophyllum Nägeli & Peter,(Nägeli & Peter)
wfo-1000086855,urn:lsid:ipni.org:names:77373451-1,Moscharia rosea,Desf.,"Tabl. École Bot., ed. 3 (Cat. Pl. Horti Paris.) 446. 1832 ",nom. illeg. nom. superfl.,,
wfo-1200116423,urn:lsid:ipni.org:names:77373452-1,Chrysanthemum praecox,(M.Bieb.) Desf.,"Tabl. École Bot., ed. 3 (Cat. Pl. Horti Paris.) 447. 1832 ",,Asteraceae Pyrethrum praecox M.Bieb.,(M.Bieb.)
wfo-1000087329,urn:lsid:ipni.org:names:77373454-1,Aster [infragen.unranked] Kingiani,Rydb.,Fl. Rocky Mts. 879. 1917 ,,,
wfo-1200116425,urn:lsid:ipni.org:names:77373459-1,Seriola commutata,(Spreng.) Desf.,"Tabl. École Bot., ed. 3 (Cat. Pl. Horti Paris.) 444. 1832 ",,Asteraceae Rodigia commutata Spreng.,(Spreng.)
wfo-0000102370,urn:lsid:ipni.org:names:77373467-1,Hieracium nigritellum subsp. seirasicum,Zahn,Hierac. Alp. Mar. 131. 1916 ,,,
wfo-0000056849,urn:lsid:ipni.org:names:77373468-1,Hieracium armerioides subsp. seirasicum,(Zahn) Zahn,"Pflanzenr. (Engler) IV, 280(Heft 75): 140. 1921 ",,Asteraceae Hieracium nigritellum Arv.-Touv. subsp. seirasicum Zahn,(Zahn)
wfo-1200066802,urn:lsid:ipni.org:names:77373469-1,Hieracium armerioides subsp. siphonophorum,Wilczek & Zahn,Bull. Murith. Soc. Valais. Sci. Nat. 42: 190. 1925 ,,,
wfo-0000103812,urn:lsid:ipni.org:names:77373470-1,Hieracium murrianum subsp. arolae,Murr,Deutsche Bot. Monatsschr. 16: 5. 1898 ,,,
wfo-0000002110,urn:lsid:ipni.org:names:77373471-1,Hieracium arolae,(Murr) Zahn,"Syn. Deut. Schweiz. Fl., ed. 3 [Hallier & Brand] 1848. 1901 ",,Asteraceae Hieracium murrianum Arv.-Touv. ex Murr subsp. arolae Murr,(Murr)
wfo-1200066803,urn:lsid:ipni.org:names:77373472-1,Hieracium arpadianum subsp. sellanum,Zahn,Hierac. Alp. Mar. 327. 1916 ,,,
wfo-1200066804,urn:lsid:ipni.org:names:77373473-1,Hieracium arpadianum subsp. subscariolaceum,Zahn,Hierac. Alp. Mar. 327. 1916 ,,,
wfo-1200066813,urn:lsid:ipni.org:names:77373474-1,Hieracium atratum subsp. neohayekii,Zahn,"Ill. Fl. Mitt.-Eur. 6(2): 1311. 1929 [May 1929] , as 'neo-Hayékii'",,,
wfo-1200066814,urn:lsid:ipni.org:names:77373476-1,Hieracium atratum subsp. pseudoleicolor,Fen. & Zahn,Beibl. Bot. Jahrb. Syst. 135: 29. 1925 ,,,
wfo-1200066819,urn:lsid:ipni.org:names:77373478-1,Hieracium bastrerianum subsp. pramolicum,Zahn,"Pflanzenr. (Engler) IV, 280(Heft 79): 934. 1922 ",,,
wfo-0000102221,urn:lsid:ipni.org:names:77373479-1,Hieracium caesium subsp. pseudobenzianum,Dalla Torre & Sarnth.,"Fl. Tirol 6(3): 868. 1911 [Nov-Dec 1911] , as 'pseudo-Benzianum'",,,
wfo-0000084636,urn:lsid:ipni.org:names:77373480-1,Hieracium benzianum subsp. pseudobenzianum,(Dalla Torre & Sarnth.) Zahn,"Pflanzenr. (Engler) IV, 280: 506. 1921 ",,Asteraceae Hieracium caesium (Fr.) Fr. subsp. pseudobenzianum Dalla Torre & Sarnth.,(Dalla Torre & Sarnth.)
wfo-0000092834,urn:lsid:ipni.org:names:77373481-1,Hieracium benzianum subsp. vulgatifolium,(Zahn) Zahn,"Pflanzenr. (Engler) IV, 280: 507. 1921 ",,Asteraceae Hieracium ausserdorferi Hausm. ex Oborny subsp. vulgatiflorum Zahn,(Zahn)
wfo-1200066824,urn:lsid:ipni.org:names:77373482-1,Hieracium bifidum subsp. basicuneatifolium,(Dalla Torre & Sarnth.) Müll.Dornst.,Mitt. Vereins Naturwiss. Math. Ulm. 20: 29. 1931 ,,Asteraceae Hieracium psammogenes (Zahn) Zahn var. basicuneatifolium Dalla Torre & Sarnth.,(Dalla Torre & Sarnth.)
wfo-1200116494,urn:lsid:ipni.org:names:77373483-1,Hieracium bifidum [infrasp.unranked] basicuneatum,Zahn,"Fl. Schweiz (Schinz), ed. 2. 2: 286. 1905 ",,,
wfo-0000062013,urn:lsid:ipni.org:names:77373484-1,Hieracium bifidum subsp. basicuneatum,(Zahn) Zahn,Neue Denkschr. Allg. Schweiz. Ges. Gesammten Naturwiss. 40: 413. 1906 ,,Asteraceae Hieracium bifidum Kit. ex Hornem. [infrasp.unranked] basicuneatum Zahn,(Zahn)
wfo-1200066825,urn:lsid:ipni.org:names:77373489-1,Hieracium bifidum subsp. bifidipraecox,Fen. & Zahn,Beibl. Bot. Jahrb. Syst. 135: 28. 1925 ,,,
wfo-1200066827,urn:lsid:ipni.org:names:77373490-1,Hieracium bifidum subsp. bolognense,Zahn,Notizbl. Bot. Gart. Berlin-Dahlem 9: 418. 1925 ,,,
wfo-1200066829,urn:lsid:ipni.org:names:77373491-1,Hieracium bifidum subsp. caesioprasinum,Zahn,Syn. Mitteleur. Fl. 12(2): 614. 1934 ,,,
wfo-0000104860,urn:lsid:ipni.org:names:77373492-1,Hieracium bifidum subsp. cordigerum,(Norrl.) Zahn,"Pflanzenr. (Engler) IV, 280(Heft 76): 427. 1921 ",,Asteraceae Hieracium murorum L. subsp. cordigerum Norrl.,(Norrl.)
wfo-1200116433,urn:lsid:ipni.org:names:77373493-1,Hieracium dolomiticum,Hausm.,"Führer Deut. Pfl., ed. 2. 441. 1881 ",,,
wfo-0000060740,urn:lsid:ipni.org:names:77373494-1,Hieracium bifidum subsp. dolomiticum,(Hausm.) Dalla Torre & Sarnth.,Fl. Tirol 6(3): 835. 1911 ,,Asteraceae Hieracium dolomiticum Hausm.,(Hausm.)
wfo-1200066833,urn:lsid:ipni.org:names:77373495-1,Hieracium bifidum subsp. fenarolii,P.Rossi & Zahn,Syn. Mitteleur. Fl. 12(2): 636. 1934 ,,,
wfo-1200066835,urn:lsid:ipni.org:names:77373496-1,Hieracium bifidum subsp. gardetanum,P.Rossi & Zahn,Syn. Mitteleur. Fl. 12(2): 635. 1934 ,,,
wfo-0000110095,urn:lsid:ipni.org:names:77373497-1,Hieracium incisum subsp. laceridens,Murr ex Zahn,"Syn. Deut. Schweiz. Fl., ed. 3 [Hallier & Brand] 3: 1800. 1901 ",,,
wfo-0000108936,urn:lsid:ipni.org:names:77373498-1,Hieracium bifidum subsp. laceridens,(Murr ex Zahn) Zahn,"Pflanzenr. (Engler) IV, 280: 433. 1921 ",,Asteraceae Hieracium incisum Hoppe subsp. laceridens Murr ex Zahn,(Murr ex Zahn)
wfo-1200066839,urn:lsid:ipni.org:names:77373499-1,Hieracium bifidum subsp. megalocalathium,P.Rossi & Zahn,Syn. Mitteleur. Fl. 12(2): 625. 1934 ,,,
wfo-0000099221,urn:lsid:ipni.org:names:77373500-1,Hieracium psammogenes subsp. oreitiforme,Zahn,Hierac. Alp. Mar. 187. 1916 ,,,
wfo-1200066844,urn:lsid:ipni.org:names:77373501-1,Hieracium bifidum subsp. poliomelanum,Zahn,"Pflanzenr. (Engler) IV, 280(Heft 76): 423. 1921 ",,,
wfo-1200116435,urn:lsid:ipni.org:names:77373506-1,Hieracium psammogenes f. pseudobasicuneatum,Touton ex Dalla Torre & Sarnth.,Fl. Tirol 6(3): 855. 1911 [Nov-Dec 1911] ,,,
wfo-0000081069,urn:lsid:ipni.org:names:77373608-1,Hieracium segureum subsp. cirritiforme,Zahn,Neue Denkschr. Allg. Schweiz. Ges. Gesammten Naturwiss. 40: 650. 1906 ,,,
wfo-1200067370,urn:lsid:ipni.org:names:77373609-1,Hieracium segureum subsp. exilentoides,Zahn,Hierac. Alp. Mar. 313. 1916 [Dec 1916] ,,,
wfo-1200067371,urn:lsid:ipni.org:names:77373610-1,Hieracium segureum subsp. rivifrigidi,Zahn,Hierac. Alp. Mar. 313. 1916 [Dec 1916] ,,,
wfo-1200067378,urn:lsid:ipni.org:names:77373611-1,Hieracium × serratum subsp. schwarzii,K.Harz & Zahn,Ill. Fl. Mitt.-Eur. 6: 1316. 1929 [May 1929] ,,,
wfo-1200067382,urn:lsid:ipni.org:names:77373612-1,Hieracium simia subsp. subincertum,Zahn,"Pflanzenr. (Engler) IV, 280: 694. 1921 [18 Oct 1921] ",,,
wfo-0000076957,urn:lsid:ipni.org:names:77373613-1,Hieracium spectabile,Fr. ex Arv.-Touv.,"Ann. Soc. Linn. Lyon sér. 2, 34: 26. 1888 ",,,
wfo-1200067409,urn:lsid:ipni.org:names:77373614-1,Hieracium tephropogon subsp. subintermedium,Zahn,"Syn. Deut. Schweiz. Fl., ed. 3 [Hallier & Brand] 1820. 1901 [Sep 1901] ",,,
wfo-0000102837,urn:lsid:ipni.org:names:77373615-1,Hieracium umbellatum subsp. brevifolioides,Zahn,Neue Denkschr. Allg. Schweiz. Ges. Gesammten Naturwiss. 40: 683. 1906 ,,,
wfo-1200067418,urn:lsid:ipni.org:names:77373616-1,Hieracium umbrosum subsp. mindinoicum,Zahn,Hierac. Alp. Mar. 297. 1916 [Dec 1916] ,,,
wfo-1200067421,urn:lsid:ipni.org:names:77373617-1,Hieracium umbrosum subsp. visaillense,Palez. & Zahn,"Bull. Soc. Bot. Genève sér. 2, 17: 357. 1925 [15 Apr 1925] ",,,
wfo-1200067423,urn:lsid:ipni.org:names:77373618-1,Hieracium urticaceum subsp. amplexicauliforme,Zahn,Ill. Fl. Mitt.-Eur. 6: 1319. 1929 [May 1929] ,,,
wfo-0000019053,urn:lsid:ipni.org:names:77373619-1,Hieracium verbascifolium,Vill.,Préc. Voy. Bot. 56. 1812 [4 Jun 1812] ,,,
wfo-1200067433,urn:lsid:ipni.org:names:77373620-1,Hieracium verbascifolium subsp. mallobrachion,Zahn,Hierac. Alp. Mar. 245. 1916 [Dec 1916] ,,,
wfo-1200067434,urn:lsid:ipni.org:names:77373621-1,Hieracium villosum subsp. albolanatum,Nägeli & Peter,Hierac. Mitt.-Eur. 2: 101. 1886 [Aug 1886] ,,,
wfo-0000049908,urn:lsid:ipni.org:names:77373622-1,Hieracium villosum subsp. calvifolium,Nägeli & Peter,Hierac. Mitt.-Eur. 2: 103. 1886 [Aug 1886] ,,,
wfo-0000055449,urn:lsid:ipni.org:names:77373623-1,Hieracium villosum subsp. heterophyllum,Nägeli & Peter,Hierac. Mitt.-Eur. 2: 93. 1886 [Aug 1886] ,,,
wfo-0000058614,urn:lsid:ipni.org:names:77373624-1,Hieracium villosum subsp. ovalifolium,Nägeli & Peter,Hierac. Mitt.-Eur. 2: 101. 1886 [Aug 1886] ,,,
wfo-0000057187,urn:lsid:ipni.org:names:77373625-1,Hieracium villosum subsp. undulifolium,Nägeli & Peter,Hierac. Mitt.-Eur. 2: 99. 1886 [Aug 1886] ,,,
wfo-1200067439,urn:lsid:ipni.org:names:77373626-1,Hieracium viscosum subsp. lactucoides,Zahn,Hierac. Alp. Mar. 321. 1916 [Dec 1916] ,,,
wfo-1200067442,urn:lsid:ipni.org:names:77373627-1,Hieracium viscosum subsp. viscosiforme,Zahn,Hierac. Alp. Mar. 320. 1916 [Dec 1916] ,,,
wfo-0000110916,urn:lsid:ipni.org:names:77373628-1,Hieracium vollmannii subsp. grimsulicola,Zahn,Neue Denkschr. Allg. Schweiz. Ges. Gesammten Naturwiss. 40: 563. 1906 ,,,
wfo-1200067455,urn:lsid:ipni.org:names:77373629-1,Hieracium wilczekianum subsp. trigonolepium,Zahn,"Pflanzenr. (Engler) IV, 280: 127. 1921 [18 Oct 1921] ",,,
wfo-0000064744,urn:lsid:ipni.org:names:77373632-1,Hieracium christii,Arv.-Touv.,Spicil. Rar. Hierac. 44. 1886 [Mar 1886] ,,,
wfo-0000098545,urn:lsid:ipni.org:names:77373633-1,Hieracium ochroleucum subsp. grimsulanum,Zahn,"Fl. Schweiz (Schinz), ed. 2. 2: 338. 1905 [Sep 1905] ",,,
wfo-0000133951,urn:lsid:ipni.org:names:77373635-1,Hieracium picroides subsp. grimsulanum,(Zahn) Zahn,"Fl. Schweiz (Schinz), ed. 3. 2: 486. 1914 [Jul 1914] ",,Asteraceae Hieracium ochroleucum Schleich. ex Hoppe subsp. grimsulanum Zahn,(Zahn)
wfo-1200040941,urn:lsid:ipni.org:names:77373636-1,Hieracium porrectum subsp. elongatiforme,(Zahn) Zahn,"Pflanzenr. (Engler) IV, 280: 125. 1921 [4 Feb 1921] ",,Asteraceae Hieracium × subelongatum Nägeli & Peter subsp. elongatiforme Zahn,(Zahn)
wfo-1200040942,urn:lsid:ipni.org:names:77373637-1,Hieracium porrectum subsp. subelongatum,(Nägeli & Peter) Zahn,"Pflanzenr. (Engler) IV, 280: 125. 1921 [4 Feb 1921] ",,Asteraceae Hieracium × subelongatum Nägeli & Peter,(Nägeli & Peter)
wfo-1000086869,urn:lsid:ipni.org:names:77373639-1,Olearia umbricola,Albr.,Telopea 29: 470. 2025 [4 Dec 2025] [epublished],,,
wfo-0000111861,urn:lsid:ipni.org:names:77373640-1,Hieracium illyricum subsp. prediliense,Nägeli & Peter,Hierac. Mitt.-Eur. 2: 60. 1886 [Mar 1886] ,,,
wfo-0000069117,urn:lsid:ipni.org:names:77373641-1,Hieracium lanceolatum subsp. juvonis,Murr,Oesterr. Bot. Z. 53: 423. 1903 ,,,
wfo-0000102745,urn:lsid:ipni.org:names:77373642-1,Hieracium prenanthoides subsp. juvonis,(Murr) Zahn,"Pflanzenr. (Engler) IV, 280: 757. 1921 [18 Oct 1921] ",,Asteraceae Hieracium lanceolatum Vill. subsp. juvonis Murr,(Murr)
wfo-0000108531,urn:lsid:ipni.org:names:77373644-1,Hieracium prenanthoides subsp. transalpinum,(Arv.-Touv.) Zahn,"Pflanzenr. (Engler) IV, 280: 757. 1921 [18 Oct 1921] ",,Asteraceae Hieracium transalpinum Arv.-Touv.,(Arv.-Touv.)
wfo-1200067335,urn:lsid:ipni.org:names:77373661-1,Hieracium pseudostenoplecum subsp. ochroleuciforme,Murr & Zahn,Oesterr. Bot. Z. 53: 425. 1903 ,,,
wfo-0000097201,urn:lsid:ipni.org:names:77373664-1,Hieracium racemosum subsp. stiriacum,(A.Kern. ex Willk.) Zahn,Magyar Bot. Lapok 25: 391. 1927 ,,Asteraceae Hieracium stiriacum A.Kern. ex Willk.,(A.Kern. ex Willk.)
wfo-0000102874,urn:lsid:ipni.org:names:77373665-1,Hieracium racemosum subsp. tenuifolium,(Host) Zahn,Syn. Mitteleur. Fl. 12(3): 612. 1838 [2 May 1838] ,,Asteraceae Hieracium tenuifolium Host,(Host)
wfo-1200116436,urn:lsid:ipni.org:names:77373668-1,Hieracium rapunculoides var. contractum,Arv.-Touv.,"Ann. Soc. Linn. Lyon sér. 2, 34: 88. 1888 ",,,
wfo-0000030386,urn:lsid:ipni.org:names:77373669-1,Hieracium rapunculoides subsp. contractum,(Arv.-Touv.) Zahn,Neue Denkschr. Allg. Schweiz. Ges. Gesammten Naturwiss. 40: 653. 1906 ,,Asteraceae Hieracium rapunculoides Arv.-Touv. var. contractum Arv.-Touv.,(Arv.-Touv.)
wfo-1200116437,urn:lsid:ipni.org:names:77373670-1,Hieracium × silsinum var. subsilsinum,Zahn,"Syn. Deut. Schweiz. Fl., ed. 3 [Hallier & Brand] 1854. 1901 [Sep 1901] ",,,
wfo-0000101811,urn:lsid:ipni.org:names:77373671-1,Hieracium symphytaceum subsp. neoprenanthes,(Arv.-Touv.) Zahn,Hierac. Alp. Mar. 353. 1916 [Dec 1916] ,,Asteraceae Hieracium neoprenanthes Arv.-Touv.,(Arv.-Touv.)
wfo-0000058749,urn:lsid:ipni.org:names:77373672-1,Hieracium symphytaceum subsp. sarracenicum,(Arv.-Touv. & Belli) Zahn,Hierac. Alp. Mar. 357. 1916 [Dec 1916] ,,Asteraceae Hieracium sarracenicum Arv.-Touv. & Belli,(Arv.-Touv. & Belli)
wfo-0000044541,urn:lsid:ipni.org:names:77373677-1,Hieracium odontinum,Arv.-Touv. ex Belli,Fl. Anal. Italia 3: 499. 1904 [Apr 1904] ,,,
wfo-0000097313,urn:lsid:ipni.org:names:77373679-1,Hieracium symphytaceum subsp. odontinum,(Arv.-Touv. ex Belli) Zahn,Hierac. Alp. Mar. 356. 1916 [Dec 1916] ,,Asteraceae Hieracium odontinum Arv.-Touv. ex Belli,(Arv.-Touv. ex Belli)
wfo-0000103817,urn:lsid:ipni.org:names:77373680-1,Hieracium tomentosum subsp. phlomidifolium,(Arv.-Touv.) Nägeli & Peter,Hierac. Mitt.-Eur. 2: 281. 1889 [Aug 1889] ,,Asteraceae Hieracium phlomidifolium Arv.-Touv.,(Arv.-Touv.)
wfo-1200111090,urn:lsid:ipni.org:names:77373682-1,Hieracium integrifolium subsp. acrotephrophorum,Zahn,"Fl. Schweiz (Schinz), ed. 3. 2: 480. 1914 [Jul 1914] ",,,
wfo-1200067415,urn:lsid:ipni.org:names:77373683-1,Hieracium umbrosum subsp. acrotephrophorum,(Zahn) Zahn,"Pflanzenr. (Engler) IV, 280: 791. 1921 [18 Oct 1921] ",,Asteraceae Hieracium integrifolium Hoppe ex Willd. subsp. acrotephrophorum Zahn,(Zahn)
wfo-1200111093,urn:lsid:ipni.org:names:77373684-1,Hieracium integrifolium var. subexilentum,Zahn,Neue Denkschr. Allg. Schweiz. Ges. Gesammten Naturwiss. 40: 641. 1906 ,,,
wfo-1200067420,urn:lsid:ipni.org:names:77373685-1,Hieracium umbrosum subsp. subexilentum,(Zahn) Zahn,Hierac. Alp. Mar. 303. 1916 [Dec 1916] ,,Asteraceae Hieracium integrifolium Hoppe ex Willd. var. subexilentum Zahn,(Zahn)
wfo-0000098226,urn:lsid:ipni.org:names:77373687-1,Hieracium elongatum subsp. calvulum,Nägeli & Peter,Hierac. Mitt.-Eur. 2: 219. 1886 [Aug 1886] ,,,
wfo-0000088786,urn:lsid:ipni.org:names:77373688-1,Hieracium valdepilosum subsp. calvulum,(Nägeli & Peter) Zahn,"Syn. Deut. Schweiz. Fl., ed. 3 [Hallier & Brand] 1868. 1901 [Sep 1901] ",,Asteraceae Hieracium elongatum Lapeyr. subsp. calvulum Nägeli & Peter,(Nägeli & Peter)
wfo-0000076124,urn:lsid:ipni.org:names:77373691-1,Hieracium interjectum,Beck,Fl. Hernstein 129. 1884 ,,,
wfo-0000101260,urn:lsid:ipni.org:names:77373692-1,Hieracium valdepilosum subsp. interjectum,(Beck) Zahn,"Pflanzenr. (Engler) IV, 280: 120. 1921 [4 Feb 1921] ",,Asteraceae Hieracium interjectum Beck,(Beck)
wfo-0000081474,urn:lsid:ipni.org:names:77373693-1,Hieracium elongatum subsp. oligophyllum,Nägeli & Peter,Hierac. Mitt.-Eur. 2: 220. 1886 [Aug 1886] ,,,
wfo-0000103023,urn:lsid:ipni.org:names:77373695-1,Hieracium valdepilosum subsp. oligophyllum,(Nägeli & Peter) Zahn,"Syn. Deut. Schweiz. Fl., ed. 3 [Hallier & Brand] 1868. 1901 [Sep 1901] ",,Asteraceae Hieracium elongatum Lapeyr. subsp. oligophyllum Nägeli & Peter,(Nägeli & Peter)
wfo-0000101045,urn:lsid:ipni.org:names:77373696-1,Hieracium kerneri subsp. austroitalicum,Zahn,Allg. Bot. Z. Syst. 7: 146. 1901 ,,,
wfo-0000105359,urn:lsid:ipni.org:names:77373697-1,Hieracium valoddae subsp. austroitalicum,(Zahn) Zahn,"Pflanzenr. (Engler) IV, 280: 620. 1921 [18 Oct 1921] ",,Asteraceae Hieracium kerneri Ausserd. ex Zahn subsp. austroitalicum Zahn,(Zahn)
wfo-0000016887,urn:lsid:ipni.org:names:77373831-1,Chrysanthemum halleri,Vitman,Summa Pl. 5: 99. 1791 ,,,
wfo-0000042786,urn:lsid:ipni.org:names:77373834-1,Leucanthemum halleri,(Suter) Ducommun,Taschenb. Schweiz. Bot. 383. 1869 ,,Asteraceae Chrysanthemum halleri Suter,(Suter)
wfo-0000079033,urn:lsid:ipni.org:names:77373970-1,Vernonia hochstetteri,Sch.Bip. ex Walp.,Repert. Bot. Syst. (Walpers) 2: 945. 1843 [Dec 1843] ,,,
wfo-1000087125,urn:lsid:ipni.org:names:77374036-1,Senecio chushanensis,S.S.Ying,New Taxa New Names 8: 444. 2025 [30 Nov 2025] [epublished],,,
wfo-1000087126,urn:lsid:ipni.org:names:77374037-1,Cirsium humile,S.S.Ying,"New Taxa New Names 8: 450. 2025 [30 Nov 2025] , as 'humilis' [epublished]",,,
wfo-1000087127,urn:lsid:ipni.org:names:77374038-1,Cirsium yulaoense,S.S.Ying,New Taxa New Names 8: 456. 2025 [30 Nov 2025] [epublished],,,
wfo-4100006355,urn:lsid:ipni.org:names:77374039-1,Cladocarpesium,T.Deng & Qun Liu,J. Syst. Evol. 64(x): 9 of 11. 2025 [30 Oct 2025] [epublished],,,
wfo-1000087128,urn:lsid:ipni.org:names:77374040-1,Cladocarpesium abrotanoides,(L.) T.Deng & Qun Liu,J. Syst. Evol. 64(x): 9 of 11. 2025 [30 Oct 2025] [epublished],,Asteraceae Carpesium abrotanoides L.,(L.)
wfo-1000087129,urn:lsid:ipni.org:names:77374041-1,Ixeridium morrisonense,S.S.Ying,New Taxa New Names 8: 463. 2025 [30 Nov 2025] [epublished],,,
wfo-1000087130,urn:lsid:ipni.org:names:77374042-1,Carpesium yulaoense,S.S.Ying,New Taxa New Names 8: 468. 2025 [30 Nov 2025] [epublished],,,
wfo-1000087131,urn:lsid:ipni.org:names:77374043-1,Senecio taigongensis,S.S.Ying,New Taxa New Names 8: 483. 2025 [30 Nov 2025] [epublished],,,
wfo-1200116480,urn:lsid:ipni.org:names:77374044-1,Jungia auriculata,(Lag.) S.S.Ying,New Taxa New Names 8: 489. 2025 [30 Nov 2025] [epublished],nom. illeg. later homonym,Asteraceae Martrasia auriculata Lag.,(Lag.)
wfo-1200116481,urn:lsid:ipni.org:names:77374045-1,Jungia crenata,(Lag.) S.S.Ying,New Taxa New Names 8: 489. 2025 [30 Nov 2025] [epublished],nom. illeg. later homonym,Asteraceae Martrasia crenata Lag.,(Lag.)
wfo-1000087132,urn:lsid:ipni.org:names:77374046-1,Jungia purpurea,(Willd. ex Steud.) S.S.Ying,New Taxa New Names 8: 489. 2025 [30 Nov 2025] [epublished],,Asteraceae Rhinactina purpurea Willd. ex Steud.,(Willd. ex Steud.)
wfo-1000087133,urn:lsid:ipni.org:names:77374047-1,Jurinea chamaecynara,(Jaub. & Spach) S.S.Ying,New Taxa New Names 8: 489. 2025 [30 Nov 2025] [epublished],,Asteraceae Jurinella chamaecynara Jaub. & Spach,(Jaub. & Spach)
wfo-1000087134,urn:lsid:ipni.org:names:77374048-1,Aster parlatorei,(Venzo ex Pamp.) S.S.Ying,New Taxa New Names 8: 489. 2025 [30 Nov 2025] [epublished],nom. inval.    Basionym not validly published,,(Venzo ex Pamp.)
wfo-1000087135,urn:lsid:ipni.org:names:77374049-1,Afrocarduus conjungens,"(R.E.Fr.) N.Garcia, Moreyra & Susanna",J. Syst. Evol. 64(x): 11 of 20. 2025 [27 Oct 2025] [epublished],,Asteraceae Carduus conjungens R.E.Fr.,(R.E.Fr.)
wfo-1000087136,urn:lsid:ipni.org:names:77374050-1,Afrocarduus chamaecephalus,"(Vatke) N.Garcia, Moreyra & Susanna",J. Syst. Evol. 64(x): 11 of 20. 2025 [27 Oct 2025] [epublished],,Asteraceae Cnicus chamaecephalus Vatke,(Vatke)
wfo-1000087137,urn:lsid:ipni.org:names:77374052-1,Afrocarduus ellenbeckii,"(R.E.Fr.) N.Garcia, Moreyra & Susanna",J. Syst. Evol. 64(x): 11 of 20. 2025 [27 Oct 2025] [epublished],,Asteraceae Carduus ellenbeckii R.E.Fr.,(R.E.Fr.)
wfo-1000087138,urn:lsid:ipni.org:names:77374053-1,Afrocarduus eremocephalus,"(Chiov.) N.Garcia, Moreyra & Susanna",J. Syst. Evol. 64(x): 12 of 20. 2025 [27 Oct 2025] [epublished],,Asteraceae Carduus eremocephalus Chiov.,(Chiov.)
wfo-1000087139,urn:lsid:ipni.org:names:77374054-1,Afrocarduus kazmii,"Moreyra, Calleja & Susanna",J. Syst. Evol. 64(x): 12 of 20. 2025 [27 Oct 2025] [epublished],,,
wfo-1000087140,urn:lsid:ipni.org:names:77374055-1,Afrocarduus nanus,"(R.E.Fr.) N.Garcia, Moreyra & Susanna",J. Syst. Evol. 64(x): 14 of 20. 2025 [27 Oct 2025] [epublished],,Asteraceae Carduus nanus R.E.Fr.,(R.E.Fr.)
wfo-1000087141,urn:lsid:ipni.org:names:77374056-1,Afrocarduus platyphyllus,"(R.E.Fr.) N.Garcia, Moreyra & Susanna",J. Syst. Evol. 64(x): 15 of 20. 2025 [27 Oct 2025] [epublished],,Asteraceae Carduus platyphyllus R.E.Fr.,(R.E.Fr.)
wfo-1000087142,urn:lsid:ipni.org:names:77374057-1,Afrocarduus theodori,"(R.E.Fr.) N.Garcia, Moreyra & Susanna",J. Syst. Evol. 64(x): 16 of 20. 2025 [27 Oct 2025] [epublished],,Asteraceae Carduus theodori R.E.Fr.,(R.E.Fr.)
wfo-1200116498,urn:lsid:ipni.org:names:77374205-1,Pilosella florentina [infrasp.unranked] pavichii,(Heuff.) Arv.-Touv.,Bull. Soc. Dauphin. Échange Pl. 282. 1880 ,,Asteraceae Hieracium pavichii Heuff.,(Heuff.)
wfo-1000087192,urn:lsid:ipni.org:names:77374233-1,Sideranthus sect. Xanthisma,(DC.) M.A.Paz,Phytoneuron 2025-65: 2. [26 Dec 2025] [epublished],,Asteraceae Xanthisma DC.,(DC.)
wfo-1000087193,urn:lsid:ipni.org:names:77374234-1,Sideranthus texanus,(DC.) M.A.Paz,Phytoneuron 2025-65: 2. [26 Dec 2025] [epublished],,Asteraceae Xanthisma texanum DC.,(DC.)
wfo-1200116375,urn:lsid:ipni.org:names:77374235-1,Sideranthus texanus var. orientalis,(Semple) M.A.Paz,Phytoneuron 2025-65: 2. [26 Dec 2025] [epublished],,Asteraceae Xanthisma texanum DC. var. orientale Semple,(Semple)
wfo-1200116376,urn:lsid:ipni.org:names:77374236-1,Sideranthus texanus var. drummondii,(Torr. & A.Gray) Semple ex M.A.Paz,Phytoneuron 2025-65: 2. [26 Dec 2025] [epublished],,Asteraceae Centauridium drummondii Torr. & A.Gray,(Torr. & A.Gray)
wfo-1000087194,urn:lsid:ipni.org:names:77374237-1,Sideranthus sect. Blepharodon,(DC.) M.A.Paz,Phytoneuron 2025-65: 2. [26 Dec 2025] [epublished],,Asteraceae Haplopappus sect. Blepharodon DC.,(DC.)
wfo-1000087195,urn:lsid:ipni.org:names:77374238-1,Sideranthus blephariphyllus,(A.Gray) D.R.Morgan & R.L.Hartm. ex M.A.Paz,Phytoneuron 2025-65: 2. [26 Dec 2025] [epublished],,Asteraceae Haplopappus blephariphyllus A.Gray,(A.Gray)
wfo-1000087196,urn:lsid:ipni.org:names:77374239-1,Sideranthus coloradoensis,(A.Gray) D.R.Morgan & R.L.Hartm. ex M.A.Paz,Phytoneuron 2025-65: 3. [26 Dec 2025] [epublished],,Asteraceae Aster coloradoensis A.Gray,(A.Gray)
wfo-1000087197,urn:lsid:ipni.org:names:77374240-1,Sideranthus crutchfieldii,(B.L.Turner) D.R.Morgan & R.L.Hartm. ex M.A.Paz,Phytoneuron 2025-65: 3. [26 Dec 2025] [epublished],,Asteraceae Machaeranthera crutchfieldii B.L.Turner,(B.L.Turner)
wfo-1200116377,urn:lsid:ipni.org:names:77374241-1,Sideranthus grindelioides var. depressus,(Maguire) D.R.Morgan & R.L.Hartm. ex M.A.Paz,Phytoneuron 2025-65: 3. [26 Dec 2025] [epublished],,Asteraceae Haplopappus nuttallii Clem. & E.G.Clem. var. depressus Maguire,(Maguire)
wfo-1000087198,urn:lsid:ipni.org:names:77374242-1,Sideranthus gymnocephalus,(DC.) D.R.Morgan & R.L.Hartm. ex M.A.Paz,Phytoneuron 2025-65: 3. [26 Dec 2025] [epublished],,Asteraceae Haplopappus gymnocephalus DC.,(DC.)
wfo-1000087199,urn:lsid:ipni.org:names:77374243-1,Sideranthus gypsophilus,(B.L.Turner) D.R.Morgan & R.L.Hartm. ex M.A.Paz,Phytoneuron 2025-65: 3. [26 Dec 2025] [epublished],,Asteraceae Machaeranthera gypsophila B.L.Turner,(B.L.Turner)
wfo-1000087200,urn:lsid:ipni.org:names:77374244-1,Sideranthus johnstonii,(S.F.Blake) M.A.Paz,Phytoneuron 2025-65: 3. [26 Dec 2025] [epublished],,Asteraceae Haplopappus johnstonii S.F.Blake,(S.F.Blake)
wfo-1000087201,urn:lsid:ipni.org:names:77374245-1,Sideranthus restiformis,(B.L.Turner) M.A.Paz,Phytoneuron 2025-65: 3. [26 Dec 2025] [epublished],,Asteraceae Machaeranthera restiformis B.L.Turner,(B.L.Turner)
wfo-1000087202,urn:lsid:ipni.org:names:77374246-1,Sideranthus pseudorestiformis,(B.L.Turner) M.A.Paz,Phytoneuron 2025-65: 3. [26 Dec 2025] [epublished],,Asteraceae Xanthisma pseudorestiforme B.L.Turner,(B.L.Turner)
wfo-1000087203,urn:lsid:ipni.org:names:77374247-1,Sideranthus rhizomatus,(M.C.Johnst.) D.R.Morgan & R.L.Hartm. ex M.A.Paz,Phytoneuron 2025-65: 3. [26 Dec 2025] [epublished],,Asteraceae Haplopappus rhizomatus M.C.Johnst.,(M.C.Johnst.)
wfo-1000087204,urn:lsid:ipni.org:names:77374248-1,Sideranthus arenarius,(Benth.) D.R.Morgan & R.L.Hartm. ex M.A.Paz,Phytoneuron 2025-65: 3. [26 Dec 2025] [epublished],,Asteraceae Haplopappus arenarius Benth.,(Benth.)
wfo-1200116485,urn:lsid:ipni.org:names:77374249-1,Sideranthus spinulosus,(Pursh) Sweet,Hort. Brit. [Sweet] 1: 227. 1826 [Aug-Sep 1826] ,,Asteraceae Amellus spinulosus Pursh,(Pursh)
wfo-1200116378,urn:lsid:ipni.org:names:77374250-1,Sideranthus spinulosus var. austrotexanus,(B.L.Turner) M.A.Paz,Phytoneuron 2025-65: 3. [26 Dec 2025] [epublished],,Asteraceae Xanthisma spinulosum (Pursh) D.R.Morgan & R.L.Hartm. var. austrotexanum B.L.Turner,(B.L.Turner)
wfo-1200116379,urn:lsid:ipni.org:names:77374251-1,Sideranthus spinulosus var. hartmanii,(B.L.Turner & G.L.Nesom) M.A.Paz,Phytoneuron 2025-65: 3. [26 Dec 2025] [epublished],,Asteraceae Xanthisma spinulosum (Pursh) D.R.Morgan & R.L.Hartm. var. hartmanii B.L.Turner & G.L.Nesom,(B.L.Turner & G.L.Nesom)
wfo-1200116380,urn:lsid:ipni.org:names:77374252-1,Sideranthus spinulosus var. chihuahuanus,(B.L.Turner & R.L.Hartm.) D.R.Morgan & R.L.Hartm. ex M.A.Paz,Phytoneuron 2025-65: 3. [26 Dec 2025] [epublished],,Asteraceae Machaeranthera pinnatifida  var. chihuahuana B.L.Turner & R.L.Hartm.,(B.L.Turner & R.L.Hartm.)
wfo-1200116381,urn:lsid:ipni.org:names:77374253-1,Sideranthus spinulosus var. gooddingii,(A.Nelson) D.R.Morgan & R.L.Hartm. ex M.A.Paz,Phytoneuron 2025-65: 3. [26 Dec 2025] [epublished],,Asteraceae Sideranthus gooddingii A.Nelson,(A.Nelson)
