WFOID,IPNID,scientificName,authorship,namePublishedin,Genus,nomenclaturalStatus,originalName,originalNameAuthor
wfo-1000086593,urn:lsid:ipni.org:names:77372750-1,Youngia jianningensis,Y.Bin Chen & Y.L.Gao,Phytotaxa 731(3): 288. 2025 [2 Dec 2025] [epublished],Youngia,,,
wfo-1000065451,urn:lsid:ipni.org:names:77372961-1,Taraxacum crocelliforme,R.Doll ex Štěpánek & Kirschner,Preslia 95: 499. 2023 [21 Dec 2023] [epublished],Taraxacum,,,
wfo-1000065450,urn:lsid:ipni.org:names:77372962-1,Taraxacum tantulum,Štěpánek & Kirschner,Preslia 95: 512. 2023 [21 Dec 2023] ,Taraxacum,,,
wfo-0000106854,urn:lsid:ipni.org:names:77373013-1,Hieracium laevigatum subsp. retardatum,Zahn,"Fl. Schweiz (Schinz), ed. 2. 2: 341. 1905 [Oct 1905] ",Hieracium,,,
wfo-0000069944,urn:lsid:ipni.org:names:77373201-1,Hieracium × leiosoma subsp. abortivum,Nägeli & Peter,Hierac. Mitt.-Eur. 2: 63. 1886 [Aug 1886] ,Hieracium,,,
wfo-1200116330,urn:lsid:ipni.org:names:77373202-1,Hieracium laevigatum subsp. stenogonum,Zahn,"Pflanzenr. (Engler) IV, 280(Heft 79): 878. 1922 [14 Feb 1922] ",Hieracium,,,
wfo-1200067106,urn:lsid:ipni.org:names:77373203-1,Hieracium leiocephalum subsp. besenellum,Zahn,Syn. Mitteleur. Fl. 12(2): 76. 1930 [30 Oct 1930] ,Hieracium,,,
wfo-0000106283,urn:lsid:ipni.org:names:77373204-1,Hieracium leiocephalum subsp. abortivum,(Nägeli & Peter) Zahn,"Pflanzenr. (Engler) IV, 280(Heft 75): 77. 1921 [4 Feb 1921] ",Hieracium,,Asteraceae Hieracium × leiosoma Nägeli & Peter subsp. abortivum Nägeli & Peter,(Nägeli & Peter)
wfo-0000112376,urn:lsid:ipni.org:names:77373207-1,Hieracium × leiosoma subsp. melanocalyx,Nägeli & Peter,Hierac. Mitt.-Eur. 2: 65. 1886 [Aug 1886] ,Hieracium,,,
wfo-0000112199,urn:lsid:ipni.org:names:77373208-1,Hieracium leiocephalum subsp. melanocalyx,(Nägeli & Peter) Zahn,"Pflanzenr. (Engler) IV, 280(Heft 75): 78. 1921 [4 Feb 1921] ",Hieracium,,Asteraceae Hieracium × leiosoma Nägeli & Peter subsp. melanocalyx Nägeli & Peter,(Nägeli & Peter)
wfo-0000109548,urn:lsid:ipni.org:names:77373209-1,Hieracium × leiosoma subsp. timaviense,Nägeli & Peter,Hierac. Mitt.-Eur. 2: 64. 1886 [Aug 1886] ,Hieracium,,,
wfo-0000097231,urn:lsid:ipni.org:names:77373210-1,Hieracium leiocephalum subsp. timaviense,(Nägeli & Peter) Zahn,"Pflanzenr. (Engler) IV, 280(Heft 75): 78. 1921 [4 Feb 1921] ",Hieracium,,Asteraceae Hieracium × leiosoma Nägeli & Peter subsp. timaviense Nägeli & Peter,(Nägeli & Peter)
wfo-1200067110,urn:lsid:ipni.org:names:77373212-1,Hieracium leiopogon subsp. hyposericum,Zahn,Hierac. Alp. Mar. 203. 1916 [Dec 1916] ,Hieracium,,,
wfo-0000071084,urn:lsid:ipni.org:names:77373214-1,Hieracium leucophaeum subsp. godetii,(Christener ex Godet) Zahn,Neue Denkschr. Allg. Schweiz. Ges. Gesammten Naturwiss. 40: 518. 1906 ,Hieracium,,Asteraceae Hieracium godetii Christener ex Godet,(Christener ex Godet)
wfo-0000100409,urn:lsid:ipni.org:names:77373217-1,Hieracium vulgatum subsp. ausugum,Murr & Zahn,Deutsche Bot. Monatsschr. 20: 38. 1902 [Mar 1902] ,Hieracium,,,
wfo-0000108941,urn:lsid:ipni.org:names:77373218-1,Hieracium levicaule subsp. ausugum,(Murr & Zahn) Zahn,"Pflanzenr. (Engler) IV, 280(Heft 76): 405. 1921 [10 May 1921] ",Hieracium,,Asteraceae Hieracium vulgatum Fr. subsp. ausugum Murr & Zahn,(Murr & Zahn)
wfo-1200067118,urn:lsid:ipni.org:names:77373219-1,Hieracium levicaule subsp. eurobreunium,Zahn,"Pflanzenr. (Engler) IV, 280(Heft 76): 405. 1921 [10 May 1921] ",Hieracium,,,
wfo-0000107608,urn:lsid:ipni.org:names:77373226-1,Hieracium divisum subsp. fissicladum,Zahn,Fl. Brixen [Heimerl] 306. 1911 [Jun 1911] ,Hieracium,,,
wfo-0000065316,urn:lsid:ipni.org:names:77373227-1,Hieracium levicaule subsp. fissicladum,(Zahn) Zahn,"Pflanzenr. (Engler) IV, 280(Heft 76): 405. 1921 [10 May 1921] ",Hieracium,,Asteraceae Hieracium divisum Jord. subsp. fissicladum Zahn,(Zahn)
wfo-1200116331,urn:lsid:ipni.org:names:77373228-1,Hieracium levicaule subsp. perscissiforme,Benz & Zahn,Syn. Mitteleur. Fl. 12: 705. 1935 [28 Feb 1935] ,Hieracium,,,
wfo-1200116332,urn:lsid:ipni.org:names:77373229-1,Hieracium caesium subsp. vitulimontis,Zahn,Fl. Brixen [Heimerl] 308. 1911 [May-Jun 1911] ,Hieracium,,,
wfo-0000110889,urn:lsid:ipni.org:names:77373244-1,Hieracium lycopifolium subsp. lycopifolioides,Zahn,"Fl. Schweiz (Schinz), ed. 2. 2: 347. 1905 [Sep 1905] ",Hieracium,,,
wfo-0000104565,urn:lsid:ipni.org:names:77373245-1,Hieracium lycopifolium subsp. pseudeminens,Zahn,"Fl. Schweiz (Schinz), ed. 2. 2: 346. 1905 [Sep 1905] ",Hieracium,,,
wfo-0000095817,urn:lsid:ipni.org:names:77373246-1,Hieracium vallisiacum var. trichoprenanthes,Zahn,"Syn. Deut. Schweiz. Fl., ed. 3 [Hallier & Brand] 1921. 1902 ",Hieracium,,,
wfo-0000112766,urn:lsid:ipni.org:names:77373247-1,Hieracium lycopifolium subsp. trichoprenanthes,(Zahn) Zahn,"Fl. Schweiz (Schinz), ed. 2. 2: 346. 1905 [Sep 1905] ",Hieracium,,Asteraceae Hieracium vallisiacum Fr. var. trichoprenanthes Zahn,(Zahn)
wfo-0000061907,urn:lsid:ipni.org:names:77373275-1,Hieracium maculatum subsp. divisum,(Jord.) Zahn,"Pflanzenr. (Engler) IV, 280(Heft 76): 516. 1921 [10 May 1921] ",Hieracium,,Asteraceae Hieracium divisum Jord.,(Jord.)
wfo-1000040340,urn:lsid:ipni.org:names:77373276-1,Hieracium mattiroloanum,Arv.-Touv. & Belli,Fl. Anal. Italia 3: 482. 1904 [Apr 1904] ,Hieracium,,,
wfo-1200067136,urn:lsid:ipni.org:names:77373277-1,Hieracium mattiroloanum subsp. farinulentiforme,(Zahn) Greuter,Willdenowia 37(1): 165. 2007 [31 Aug 2007] ,Hieracium,,Asteraceae Hieracium farinulentiforme Zahn,(Zahn)
wfo-1200067137,urn:lsid:ipni.org:names:77373278-1,Hieracium mattiroloanum subsp. martellianum,(Zahn) Greuter,Willdenowia 37(1): 165. 2007 [31 Aug 2007] ,Hieracium,,Asteraceae Hieracium farinulentiforme Zahn subsp. martellianum Zahn,(Zahn)
wfo-0000102263,urn:lsid:ipni.org:names:77373279-1,Hieracium monregalense subsp. gibellianum,(Arv.-Touv. & Belli) Zahn,"Pflanzenr. (Engler) IV, 280(Heft 76): 559. 1921 [10 May 1921] ",Hieracium,,Asteraceae Hieracium gibellianum Arv.-Touv. & Belli,(Arv.-Touv. & Belli)
wfo-0000102955,urn:lsid:ipni.org:names:77373280-1,Hieracium villiferum subsp. lanosum,Nägeli & Peter,Hierac. Mitt.-Eur. 2(1): 330. 1886 [Mar 1886] ,Hieracium,,,
wfo-0000097111,urn:lsid:ipni.org:names:77373281-1,Hieracium monregalense subsp. lanosum,(Nägeli & Peter) Zahn,Hierac. Alp. Mar. 250. 1916 [Dec 1916] ,Hieracium,,Asteraceae Hieracium villiferum Nägeli & Peter subsp. lanosum Nägeli & Peter,(Nägeli & Peter)
wfo-1200067142,urn:lsid:ipni.org:names:77373285-1,Hieracium murorum subsp. adenobifidum,Wilczek & Zahn,Syn. Mitteleur. Fl. 12(2): 421. 1931 [10 Aug 1931] ,Hieracium,,,
wfo-1200067148,urn:lsid:ipni.org:names:77373286-1,Hieracium murorum subsp. basalticiforme,Korb & Zahn,Mitth. Thüring. Bot. Vereins 39: 11. 1930 ,Hieracium,,,
wfo-1200067152,urn:lsid:ipni.org:names:77373288-1,Hieracium murorum subsp. boetzkesii,Zahn,Bull. Soc. Bot. Genève 16: 157. 1925 ,Hieracium,,,
wfo-1200067154,urn:lsid:ipni.org:names:77373289-1,Hieracium murorum subsp. brachylobosum,J.Vetter & Zahn,Magyar Bot. Lapok 25: 315. 1935 ,Hieracium,,,
wfo-1000086821,urn:lsid:ipni.org:names:77373290-1,Hieracium certovicae,Chrtek f. & Szeląg,Phytotaxa 733(1): 144. 2025 [9 Dec 2025] [epublished],Hieracium,,,
wfo-1200067155,urn:lsid:ipni.org:names:77373291-1,Hieracium murorum subsp. calvifrons,Zahn,"Pflanzenr. (Engler) IV, 280(Heft 76): 300. 1921 [10 May 1921] ",Hieracium,,,
wfo-1200067160,urn:lsid:ipni.org:names:77373292-1,Hieracium murorum subsp. cirritoidiforme,Zahn,Hierac. Alp. Mar. 159. 1916 [Dec 1916] ,Hieracium,,,
wfo-1200067165,urn:lsid:ipni.org:names:77373293-1,Hieracium murorum subsp. crepidanthes,Zahn,"Pflanzenr. (Engler) IV, 280(Heft 76): 296. 1921 [10 May 1921] ",Hieracium,,,
wfo-1200112068,urn:lsid:ipni.org:names:77373295-1,Hieracium murorum subsp. denticulatifrons,J.Vetter & Zahn,Syn. Mitteleur. Fl. 12(2): 373. 1931 [10 Oct 1931] ,Hieracium,,,
wfo-1200067171,urn:lsid:ipni.org:names:77373296-1,Hieracium murorum subsp. glandellatum,Zahn,"Pflanzenr. (Engler) IV, 280(Heft 76): 315. 1921 [10 May 1921] ",Hieracium,,,
wfo-1200116334,urn:lsid:ipni.org:names:77373298-1,Hieracium murorum subsp. graminichlorum,Fen. & Zahn,"Beibl. Bot. Jahrb. Syst. 135: 27. 1925 , as 'graminochlorum'",Hieracium,,,
wfo-1200067174,urn:lsid:ipni.org:names:77373302-1,Hieracium murorum subsp. grypharioides,Zahn,Hierac. Alp. Mar. 162. 1916 [Dec 1916] ,Hieracium,,,
wfo-1200067179,urn:lsid:ipni.org:names:77373303-1,Hieracium murorum subsp. infralobatum,Zahn,Hierac. Alp. Mar. 162. 1916 [Dec 1916] ,Hieracium,,,
wfo-1200067180,urn:lsid:ipni.org:names:77373304-1,Hieracium murorum subsp. infrasericatum,Murr & Zahn,Allg. Bot. Z. Syst. 10: 99. 1904 ,Hieracium,,,
wfo-1200067181,urn:lsid:ipni.org:names:77373305-1,Hieracium murorum subsp. kassanum,Zahn,"Pflanzenr. (Engler) IV, 280(Heft 76): 290. 1921 [10 May 1921] ",Hieracium,,,
wfo-1200067185,urn:lsid:ipni.org:names:77373306-1,Hieracium murorum subsp. longilacerum,Murr & Zahn,"Pflanzenr. (Engler) IV, 280(Heft 76): 308. 1921 [10 May 1921] ",Hieracium,,,
wfo-1200112069,urn:lsid:ipni.org:names:77373312-1,Hieracium murorum subsp. lorynsicum,Krafft & Zahn,Sonderscr. Komm. Voralbe. Landesmus. 5: 21. 1928 ,Hieracium,,,
wfo-1200067191,urn:lsid:ipni.org:names:77373313-1,Hieracium murorum subsp. marmarolense,Pamp. & Zahn,Syn. Mitteleur. Fl. 12(2): 420. 1931 [10 Oct 1931] ,Hieracium,,,
wfo-1200067193,urn:lsid:ipni.org:names:77373314-1,Hieracium murorum subsp. megaleiobium,Pamp. & Zahn,Syn. Mitteleur. Fl. 12(2): 392. 1931 [10 Oct 1931] ,Hieracium,,,
wfo-1200067195,urn:lsid:ipni.org:names:77373315-1,Hieracium murorum subsp. melanosphaeroides,Romieux & Zahn,"Bull. Soc. Bot. Genève 14: 121. 1923 , as 'melanospheroides'",Hieracium,,,
wfo-1200067198,urn:lsid:ipni.org:names:77373316-1,Hieracium murorum subsp. mundellum,Zahn,"Pflanzenr. (Engler) IV, 280(Heft 76): 296. 1921 [10 May 1921] ",Hieracium,,,
wfo-1200067202,urn:lsid:ipni.org:names:77373317-1,Hieracium murorum subsp. odontobium,Zahn,"Pflanzenr. (Engler) IV, 280(Heft 76): 316. 1921 [10 May 1921] ",Hieracium,,,
wfo-1200067206,urn:lsid:ipni.org:names:77373318-1,Hieracium murorum subsp. persinuatum,Zahn,"Pflanzenr. (Engler) IV, 280(Heft 76): 334. 1921 [10 May 1921] ",Hieracium,,,
wfo-1200067209,urn:lsid:ipni.org:names:77373319-1,Hieracium murorum subsp. polygonium,Zahn,"Pflanzenr. (Engler) IV, 280(Heft 76): 315. 1921 [10 May 1921] ",Hieracium,,,
wfo-1200067210,urn:lsid:ipni.org:names:77373320-1,Hieracium murorum subsp. psammogenoides,Zahn,Sonderscr. Komm. Voralbe. Landesmus. 5: 24. 1928 ,Hieracium,,,
wfo-1000065449,urn:lsid:ipni.org:names:77373327-1,Taraxacum pseudovenustum,Štěpánek & Kirschner,Preslia 95: 521. 2023 [21 Dec 2023] [epublished],Taraxacum,,,
wfo-1000065448,urn:lsid:ipni.org:names:77373328-1,Taraxacum pygmaeum,Štěpánek & Kirschner,Preslia 95: 524. 2023 [21 Dec 2023] [epublished],Taraxacum,,,
wfo-1000065447,urn:lsid:ipni.org:names:77373332-1,Taraxacum obesum,Štěpánek & Kirschner,Preslia 95: 550. 2023 [21 Dec 2023] [epublished],Taraxacum,,,
wfo-1000065446,urn:lsid:ipni.org:names:77373335-1,Taraxacum pseudoursinum,Štěpánek & Kirschner,Preslia 95: 552. 2023 [21 Dec 2023] [epublished],Taraxacum,,,
wfo-1200067211,urn:lsid:ipni.org:names:77373336-1,Hieracium murorum subsp. pseudobifidiforme,Pamp. & Zahn,Syn. Mitteleur. Fl. 12(2): 395. 1931 [30 Oct 1931] ,Hieracium,,,
wfo-1000065445,urn:lsid:ipni.org:names:77373337-1,Taraxacum jugicola,Štěpánek & Kirschner,Preslia 95: 558. 2023 [21 Dec 2023] [epublished],Taraxacum,,,
wfo-1200067213,urn:lsid:ipni.org:names:77373339-1,Hieracium murorum subsp. pseudodiaphanoides,Gerstl. & Zahn,Magyar Bot. Lapok 25: 329. 1927 ,Hieracium,,,
wfo-1200067218,urn:lsid:ipni.org:names:77373340-1,Hieracium murorum subsp. pseudosilvularum,Zahn,Bull. Soc. Bot. Genève 16: 154. 1925 [15 Apr 1925] ,Hieracium,,,
wfo-1200067214,urn:lsid:ipni.org:names:77373341-1,Hieracium murorum subsp. pseudofritschii,Zahn,Syn. Mitteleur. Fl. 12(2): 386. 1931 [10 Oct 1931] ,Hieracium,,,
wfo-1200067219,urn:lsid:ipni.org:names:77373342-1,Hieracium murorum subsp. pseudosubulatidens,Pamp. & Zahn,Syn. Mitteleur. Fl. 12(2): 456. 1931 [10 Oct 1931] ,Hieracium,,,
wfo-1200067227,urn:lsid:ipni.org:names:77373343-1,Hieracium murorum subsp. semicontractum,P.Rossi & Zahn,Syn. Mitteleur. Fl. 12(2): 402. 1931 [10 Oct 1931] ,Hieracium,,,
wfo-1200067230,urn:lsid:ipni.org:names:77373344-1,Hieracium murorum subsp. semisilvaticiforme,Zahn,Magyar Bot. Lapok 25: 331. 1927 ,Hieracium,,,
wfo-1200067231,urn:lsid:ipni.org:names:77373345-1,Hieracium murorum subsp. semisilvularum,K.Harz & Zahn,Syn. Mitteleur. Fl. 12(2): 449. 1931 [10 Oct 1931] ,Hieracium,,,
wfo-1000065444,urn:lsid:ipni.org:names:77373346-1,Taraxacum ursinum,Štěpánek & Kirschner,Preslia 95: 561. 2023 [21 Dec 2023] [epublished],Taraxacum,,,
wfo-1200067236,urn:lsid:ipni.org:names:77373347-1,Hieracium murorum subsp. subinfrasericatum,P.Rossi & Zahn,Syn. Mitteleur. Fl. 12(2): 473. 1931 [10 Oct 1931] ,Hieracium,,,
wfo-1200067242,urn:lsid:ipni.org:names:77373348-1,Hieracium murorum subsp. tofanae,Pamp. & Zahn,Syn. Mitteleur. Fl. 12(2): 473. 1931 [10 Oct 1931] ,Hieracium,,,
wfo-1200067245,urn:lsid:ipni.org:names:77373349-1,Hieracium murorum subsp. triangulilacerum,P.Rossi & Zahn,Syn. Mitteleur. Fl. 12(2): 392. 1931 [10 Oct 1931] ,Hieracium,,,
wfo-1200067250,urn:lsid:ipni.org:names:77373350-1,Hieracium murorum subsp. variilobum,Zahn,Hierac. Alp. Mar. 160. 1916 [Dec 1916] ,Hieracium,,,
wfo-1200067251,urn:lsid:ipni.org:names:77373351-1,Hieracium murorum subsp. wulfenii,Zahn,Syn. Mitteleur. Fl. 12(2): 468. 1931 [10 Oct 1931] ,Hieracium,,,
wfo-1000065443,urn:lsid:ipni.org:names:77373352-1,Taraxacum subelegantissimum,Štěpánek & Kirschner,Preslia 95: 570. 2023 [21 Dec 2023] [epublished],Taraxacum,,,
wfo-1000065442,urn:lsid:ipni.org:names:77373353-1,Taraxacum innuptum,Štěpánek & Kirschner,Preslia 95: 572. 2023 [21 Dec 2023] [epublished],Taraxacum,,,
wfo-1000065441,urn:lsid:ipni.org:names:77373355-1,Taraxacum paclovae,Štěpánek & Kirschner,Preslia 95: 576. 2023 [21 Dec 2023] [epublished],Taraxacum,,,
wfo-1200098618,urn:lsid:ipni.org:names:77373356-1,Taraxacum sect. Oreodoxa,Štěpánek & Kirschner,Preslia 95: 580. 2023 [21 Dec 2023] [epublished],Taraxacum,,,
wfo-1000065440,urn:lsid:ipni.org:names:77373357-1,Taraxacum incredibile,Štěpánek & Kirschner,Preslia 95: 580. 2023 [21 Dec 2023] [epublished],Taraxacum,,,
wfo-0000039042,urn:lsid:ipni.org:names:77373358-1,Hieracium crepidiflorum,Polák,Oesterr. Bot. Z. 34: 155. 1884 ,Hieracium,,,
wfo-0000073989,urn:lsid:ipni.org:names:77373360-1,Hieracium murorum subsp. crepidiflorum,(Polák) Zahn,"Fl. Schweiz (Schinz), ed. 3. 2: 423. 1914 [Jul 1914] ",Hieracium,,Asteraceae Hieracium crepidiflorum Polák,(Polák)
wfo-0000030773,urn:lsid:ipni.org:names:77373362-1,Hieracium murorum var. flavescens,Evers,Verh. K. K. Zool.-Bot. Ges. Wien 46: 87. 1896 ,Hieracium,,,
wfo-0000110499,urn:lsid:ipni.org:names:77373363-1,Hieracium murorum subsp. flavescens,(Evers) Zahn,Syn. Mitteleur. Fl. 12(2): 420. 1931 [10 Oct 1931] ,Hieracium,,Asteraceae Hieracium murorum L. var. flavescens Evers,(Evers)
wfo-1200099018,urn:lsid:ipni.org:names:77373364-1,Hieracium sylvaticum [infrasp.unranked] graminicolor,Zahn,"Fl. Schweiz (Schinz), ed. 2. 2: 282. 1905 [Sep 1905] ",Hieracium,,,
wfo-0000101086,urn:lsid:ipni.org:names:77373365-1,Hieracium murorum subsp. graminicolor,(Zahn) Zahn,"Fl. Schweiz (Schinz), ed. 3. 2: 422. 1914 [Jul 1914] ",Hieracium,,Asteraceae Hieracium sylvaticum (L.) Gouan [infrasp.unranked] graminicolor Zahn,(Zahn)
wfo-1200099434,urn:lsid:ipni.org:names:77373371-1,Hieracium sylvaticum subsp. oxyodontopsis,Touton & Zahn,Neue Denkschr. Allg. Schweiz. Ges. Gesammten Naturwiss. 40: 386. 1906 ,Hieracium,,,
wfo-1200099429,urn:lsid:ipni.org:names:77373372-1,Hieracium carnosum subsp. ramosiforme,Zahn,"Syn. Deut. Schweiz. Fl., ed. 3 [Hallier & Brand] 1873. 1901 [Sep 1901] ",Hieracium,,,
wfo-0000110409,urn:lsid:ipni.org:names:77373374-1,Hieracium murorum subsp. ramosiforme,(Zahn) Zahn,"Pflanzenr. (Engler) IV, 280(Heft 76): 309. 1921 [10 May 1921] ",Hieracium,,Asteraceae Hieracium carnosum (Wiesb.) Dichtl subsp. ramosiforme Zahn,(Zahn)
wfo-0000026003,urn:lsid:ipni.org:names:77373375-1,Hieracium murorum subsp. serratifolium,(Jord. ex Boreau) Zahn,"Fl. Schweiz (Schinz), ed. 3. 2: 419. 1914 ",Hieracium,,Asteraceae Hieracium serratifolium Jord. ex Boreau,(Jord. ex Boreau)
wfo-1200099480,urn:lsid:ipni.org:names:77373378-1,Hieracium murorum subvar. subnemorense,Zahn,"Pflanzenr. (Engler) IV, 280(Heft 76): 304. 1921 [10 May 1921] ",Hieracium,,,
wfo-1200067238,urn:lsid:ipni.org:names:77373380-1,Hieracium murorum subsp. subnemorense,(Zahn) Zahn,Mitt. Naturf. Ges. Schaffhausen 5: 77. 1926 ,Hieracium,,Asteraceae Hieracium murorum L. subvar. subnemorense Zahn,(Zahn)
wfo-0000107974,urn:lsid:ipni.org:names:77373382-1,Hieracium murorum var. subsemisilvularum,Zahn,Naturwiss. Z. Lotos 74: 41. 1926 ,Hieracium,,,
wfo-0000066749,urn:lsid:ipni.org:names:77373383-1,Hieracium murorum subsp. subsemisilvularum,(Zahn) Zahn,Syn. Mitteleur. Fl. 12(2): 381. 1931 [10 Oct 1931] ,Hieracium,,Asteraceae Hieracium murorum L. var. subsemisilvularum Zahn,(Zahn)
wfo-0000102726,urn:lsid:ipni.org:names:77373384-1,Hieracium murorum subsp. sylvularum,(Boreau) Zahn,"Fl. Schweiz (Schinz), ed. 3. 2: 419. 1914 , as 'silvulárum'",Hieracium,,Asteraceae Hieracium sylvularum Boreau,(Boreau)
wfo-0000105002,urn:lsid:ipni.org:names:77373386-1,Hieracium neyranum subsp. grausonicum,Besse & Zahn,Neue Denkschr. Allg. Schweiz. Ges. Gesammten Naturwiss. 40: 610. 1906 ,Hieracium,,,
wfo-0000064595,urn:lsid:ipni.org:names:77373387-1,Hieracium nigrescens subsp. nigrescentiforme,Zahn,"Syn. Deut. Schweiz. Fl., ed. 3 [Hallier & Brand] 1845. 1901 [Sep 1901] ",Hieracium,,,
wfo-0000092632,urn:lsid:ipni.org:names:77373389-1,Hieracium nigrescens subsp. pseudorhaeticum,Zahn,"Syn. Deut. Schweiz. Fl., ed. 3 [Hallier & Brand] 1845. 1901 [Sep 1901] ",Hieracium,,,
wfo-1200116418,urn:lsid:ipni.org:names:77373390-1,Hieracium nigrescens var. subneglectum,Zahn,Neue Denkschr. Allg. Schweiz. Ges. Gesammten Naturwiss. 40: 547. 1906 ,Hieracium,,,
wfo-0000102981,urn:lsid:ipni.org:names:77373391-1,Hieracium nigrescens subsp. subneglectum,(Zahn) Zahn,Icon. Fl. Germ. Helv. (H.G.L. Reichenbach) 19(2): 178. 1908 ,Hieracium,,Asteraceae Hieracium nigrescens Willd. var. subneglectum Zahn,(Zahn)
wfo-1200067269,urn:lsid:ipni.org:names:77373404-1,Hieracium oxyodon subsp. leucochaetopodum,Fen. & Zahn,Beibl. Bot. Jahrb. Syst. 138: 23. 1927 ,Hieracium,,,
wfo-1200067271,urn:lsid:ipni.org:names:77373405-1,Hieracium oxyodon subsp. pseudoscabrellum,Zahn,"Pflanzenr. (Engler) IV, 280(Heft 75): 64. 1921 [4 Feb 1921] ",Hieracium,,,
wfo-1200067282,urn:lsid:ipni.org:names:77373406-1,Hieracium pellitum subsp. leuconeuron,Zahn,Hierac. Alp. Mar. 240. 1916 [Dec 1916] ,Hieracium,,,
wfo-1200067290,urn:lsid:ipni.org:names:77373409-1,Hieracium plantagineum subsp. gapense,(Arv.-Touv.) Zahn,"Pflanzenr. (Engler) IV, 280(Heft 75): 106. 1921 [4 Feb 1921] ",Hieracium,,Asteraceae Hieracium dentatum Hoppe var. gapense Arv.-Touv.,(Arv.-Touv.)
wfo-1200067291,urn:lsid:ipni.org:names:77373410-1,Hieracium porrifolium subsp. longibracteum,Nägeli & Peter,Hierac. Mitt.-Eur. 2: 12. 1886 [Mar 1886] ,Hieracium,,,
wfo-1200067292,urn:lsid:ipni.org:names:77373412-1,Hieracium porrifolium subsp. niphanthum,Nägeli & Peter,Hierac. Mitt.-Eur. 2: 13. 1886 [Mar 1886] ,Hieracium,,,
wfo-1200067293,urn:lsid:ipni.org:names:77373413-1,Hieracium porrifolium subsp. pseudoporrifolium,Nägeli & Peter,Hierac. Mitt.-Eur. 2: 14. 1886 [Mar 1886] ,Hieracium,,,
wfo-1200067294,urn:lsid:ipni.org:names:77373414-1,Hieracium porrifolium subsp. sparsiglandulum,Nägeli & Peter,Hierac. Mitt.-Eur. 2: 13. 1886 [Mar 1886] ,Hieracium,,,
wfo-1200067318,urn:lsid:ipni.org:names:77373416-1,Hieracium prenanthoides subsp. valdegriseum,Zahn,Hierac. Alp. Mar. 275. 1916 [Dec 1916] ,Hieracium,,,
wfo-0000074604,urn:lsid:ipni.org:names:77373419-1,Hieracium pulchellum,Gren. ex Griseb.,Abh. Königl. Ges. Wiss. Göttingen 5: 144. 1853 ,Hieracium,,,
wfo-0000079041,urn:lsid:ipni.org:names:77373420-1,Hieracium pulchellum subsp. pleioscapum,Zahn,"Syn. Deut. Schweiz. Fl., ed. 3 [Hallier & Brand] 1830. 1901 ",Hieracium,,,
wfo-1200067345,urn:lsid:ipni.org:names:77373421-1,Hieracium rapunculoides subsp. tridentatiflorum,Zahn,Hierac. Alp. Mar. 318. 1916 [Dec 1916] ,Hieracium,,,
wfo-1200066834,urn:lsid:ipni.org:names:77373422-1,Hieracium bifidum subsp. furculaceum,Zahn,Hierac. Alp. Mar. 183. 1916 [Dec 1916] ,Hieracium,,,
wfo-1200067346,urn:lsid:ipni.org:names:77373423-1,Hieracium × rostanii subsp. amphisericum,Zahn,"Pflanzenr. (Engler) IV, 280(Heft 75): 118. 1921 [4 Feb 1921] ",Hieracium,,,
wfo-1200067347,urn:lsid:ipni.org:names:77373424-1,Hieracium × rostanii subsp. bedolense,Zahn,"Pflanzenr. (Engler) IV, 280(Heft 75): 118. 1921 [4 Feb 1921] ",Hieracium,,,
wfo-0000049053,urn:lsid:ipni.org:names:77373425-1,Hieracium schmidtii subsp. subrupicola,Zahn,"Syn. Deut. Schweiz. Fl., ed. 3 [Hallier & Brand] 1778. 1901 ",Hieracium,,,
wfo-1200116343,urn:lsid:ipni.org:names:77373426-1,Hieracium scorzonerifolium subsp. antelaonis,Pamp. & Zahn,Syn. Mitteleur. Fl. 12(2): 110. 1930 [30 Oct 1930] ,Hieracium,,,
wfo-0000050016,urn:lsid:ipni.org:names:77373427-1,Hieracium scorzonerifolium subsp. divaricatum,Nägeli & Peter,Hierac. Mitt.-Eur. 2: 134. 1886 [Aug 1886] ,Hieracium,,,
wfo-0000053268,urn:lsid:ipni.org:names:77373428-1,Hieracium scorzonerifolium subsp. heterocephalum,Nägeli & Peter,Hierac. Mitt.-Eur. 2: 124. 1886 [Aug 1886] ,Hieracium,,,
wfo-0000050983,urn:lsid:ipni.org:names:77373429-1,Hieracium scorzonerifolium subsp. lonchiphylloides,Zahn ex Dalla Torre & Sarnth.,Fl. Tirol 6(3): 809. 1911 ,Hieracium,,,
wfo-0000057500,urn:lsid:ipni.org:names:77373430-1,Hieracium scorzonerifolium subsp. myocomum,Nägeli & Peter,Hierac. Mitt.-Eur. 2: 133. 1886 [Aug 1886] ,Hieracium,,,
wfo-0000058220,urn:lsid:ipni.org:names:77373431-1,Hieracium scorzonerifolium subsp. pantotrichum,Nägeli & Peter,Hierac. Mitt.-Eur. 2: 133. 1886 [Aug 1886] ,Hieracium,,,
wfo-0000057009,urn:lsid:ipni.org:names:77373432-1,Hieracium scorzonerifolium subsp. speciosiforme,Nägeli & Peter,Hierac. Mitt.-Eur. 2: 128. 1886 [Aug 1886] ,Hieracium,,,
wfo-1200112203,urn:lsid:ipni.org:names:77373433-1,Hieracium alpinum subsp. halleri,(Vill.) Ces.,Not. Nat. Civ. Lombardia 1: 304. 1884 ,Hieracium,,Asteraceae Hieracium halleri Vill.,(Vill.)
wfo-1200066789,urn:lsid:ipni.org:names:77373434-1,Hieracium alpinum subsp. marcelli,Palez. & Zahn,"Bull. Soc. Bot. Genève sér. 2, 16: 175. 1925 ",Hieracium,,,
wfo-1200066790,urn:lsid:ipni.org:names:77373435-1,Hieracium alpinum subsp. melanocephalum,(Tausch) Zahn,"Syn. Deut. Schweiz. Fl., ed. 3 [Hallier & Brand] 2(12): 1840. 1901 [Sep 1901] ",Hieracium,,Asteraceae Hieracium melanocephalum Tausch,(Tausch)
wfo-1200066793,urn:lsid:ipni.org:names:77373438-1,Hieracium amplexicaule subsp. neopetraeum,Zahn,"Pflanzenr. (Engler) IV, 280: 728. 1921 ",Hieracium,,,
wfo-0000004452,urn:lsid:ipni.org:names:77373439-1,Hieracium hololeucum,Arv.-Touv. & A.Faure,Hieracioth. Gall. 15: no. 1351. 1904 ,Hieracium,,,
wfo-0000076856,urn:lsid:ipni.org:names:77373440-1,Hieracium aphyllum subsp. hololeucum,(Arv.-Touv. & A.Faure) Zahn,"Pflanzenr. (Engler) IV, 280: 137. 1921 ",Hieracium,,Asteraceae Hieracium hololeucum Arv.-Touv. & A.Faure,(Arv.-Touv. & A.Faure)
wfo-0000090056,urn:lsid:ipni.org:names:77373441-1,Hieracium aphyllum subsp. singulare,(Zahn) Zahn,Icon. Fl. Germ. Helv. (H.G.L. Reichenbach) 19(2): 69. 1906 ,Hieracium,,Asteraceae Hieracium singulare Zahn,(Zahn)
wfo-1200066797,urn:lsid:ipni.org:names:77373442-1,Hieracium argothrix subsp. anisodon,Nägeli & Peter,Hierac. Mitt.-Eur. 2: 304. 1889 ,Hieracium,,,
wfo-1200066798,urn:lsid:ipni.org:names:77373443-1,Hieracium argothrix subsp. candidulum,Nägeli & Peter,Hierac. Mitt.-Eur. 2: 306. 1889 ,Hieracium,,,
wfo-1200066799,urn:lsid:ipni.org:names:77373444-1,Hieracium argothrix subsp. pleiobrachion,Zahn,Hierac. Alp. Mar. 247. 1916 ,Hieracium,,,
wfo-1200066800,urn:lsid:ipni.org:names:77373445-1,Hieracium armerioides subsp. collae,Zahn,"Pflanzenr. (Engler) IV, 280(Heft 75): 139. 1921 ",Hieracium,,,
wfo-0000097388,urn:lsid:ipni.org:names:77373447-1,Hieracium nigritellum subsp. hololeptomorphum,Zahn,Hierac. Alp. Mar. 132. 1916 [Dec 1916] ,Hieracium,,,
wfo-0000018292,urn:lsid:ipni.org:names:77373448-1,Hieracium armerioides subsp. hololeptomorphum,(Zahn) Zahn,"Pflanzenr. (Engler) VI, 280(Heft 75): 138. 1921 [4 Feb 1921] ",Hieracium,,Asteraceae Hieracium nigritellum Arv.-Touv. subsp. hololeptomorphum Zahn,(Zahn)
wfo-1200116493,urn:lsid:ipni.org:names:77373449-1,Hieracium cirritum [infrasp.unranked] rhombophyllum,Nägeli & Peter,Hierac. Mitt.-Eur. 2: 262. 1889 ,Hieracium,,,
wfo-0000090483,urn:lsid:ipni.org:names:77373450-1,Hieracium armerioides subsp. rhombophyllum,(Nägeli & Peter) Zahn,"Fl. Schweiz (Schinz), ed. 2. 2: 298. 1905 ",Hieracium,,Asteraceae Hieracium cirritum Arv.-Touv. [infrasp.unranked] rhombophyllum Nägeli & Peter,(Nägeli & Peter)
wfo-0000102370,urn:lsid:ipni.org:names:77373467-1,Hieracium nigritellum subsp. seirasicum,Zahn,Hierac. Alp. Mar. 131. 1916 ,Hieracium,,,
wfo-0000056849,urn:lsid:ipni.org:names:77373468-1,Hieracium armerioides subsp. seirasicum,(Zahn) Zahn,"Pflanzenr. (Engler) IV, 280(Heft 75): 140. 1921 ",Hieracium,,Asteraceae Hieracium nigritellum Arv.-Touv. subsp. seirasicum Zahn,(Zahn)
wfo-1200066802,urn:lsid:ipni.org:names:77373469-1,Hieracium armerioides subsp. siphonophorum,Wilczek & Zahn,Bull. Murith. Soc. Valais. Sci. Nat. 42: 190. 1925 ,Hieracium,,,
wfo-0000103812,urn:lsid:ipni.org:names:77373470-1,Hieracium murrianum subsp. arolae,Murr,Deutsche Bot. Monatsschr. 16: 5. 1898 ,Hieracium,,,
wfo-0000002110,urn:lsid:ipni.org:names:77373471-1,Hieracium arolae,(Murr) Zahn,"Syn. Deut. Schweiz. Fl., ed. 3 [Hallier & Brand] 1848. 1901 ",Hieracium,,Asteraceae Hieracium murrianum Arv.-Touv. ex Murr subsp. arolae Murr,(Murr)
